,title,originallink,link,description,pubDate,context
9,"<b>삼성전자</b>, <b>버즈2 프로</b> SW<b>업데이트</b>… 360도 오디오 녹음 지원",https://www.viva100.com/main/view.php?key=20230113010003956,https://www.viva100.com/main/view.php?key=20230113010003956,"<b>삼성전자</b>, <b>버즈2 프로</b> SW<b>업데이트</b>… 360도 오디오 녹음 지원 <b>삼성전자</b>가 갤럭시<b>버즈2 프로</b>와 갤럭시워치를 통해 스마트폰 카메라 기능을 한 단계 높인다.<b>삼성전자</b>는 스마트폰 동영상 촬영 시 360도 사운드 녹음이... ","Fri, 13 Jan 2023 09:32:00 +0900","삼성전자는 갤럭시버즈2 프로와 갤럭시Z 플립4·폴드4의 소프트웨어 업데이트를 통해 360 오디오 레코딩 기능을 지원한다. (사진제공=삼성전자 삼성전자가 갤럭시버즈2 프로와 갤럭시워치를 통해 스마트폰 카메라 기능을 한 단계 높인다. 삼성전자는 스마트폰 동영상 촬영 시 360도 사운드 녹음이 가능하도록 갤럭시버즈2 프로와 갤럭시Z플립4·폴드4의 소프트웨어 업데이트를 실시한다고 13일 밝혔다. 갤럭시워치5와 워치4 시리즈의 소프트웨어 업데이트를 통해 스마트폰 카메라를 원격으로 줌인·줌아웃할 수 있는 기능도 추가한다. 삼성전자는 갤럭시버즈2 프로와 갤럭시Z플립4와 폴드4의 소프트웨어 업데이트를 통해 360도 오디오 레코딩 기능을 지원한다. 갤럭시버즈2 프로 좌우에 위치한 마이크를 모두 사용해 360도 사운드를 포착한다. 예를 들어, 버즈2 프로를 착용하고, 연결된 Z플립4·폴드4로 동영상을 촬영할 경우, 촬영자는 연결된 버즈2 프로를 통해 본인이 듣는 그대로의 생생한 몰입형 사운드를 녹음할 수 있다. 전문 장비 없이도 언제 어디서든, 누구나 고품질의 실감나는 오디오를 담을 수 있다. 특히 360 오디오 레코딩은 차세대 블루투스 오디오 기술 표준인 LE 오디오를 적용했다. LE 오디오 기술은 보다 풍부하고 섬세한 사운드, 매끄러운 연결성, 향상된 배터리 수명을 제공한다. 갤럭시워치5와 워치4 시리즈엔 카메라 줌 인 줌 아웃 기능을 추가해 사용성을 높인다. 해당 기능은 2월 중 기존의 워치 카메라 컨트롤러 앱에 추가된다. 현재는 사진 촬영, 촬영한 사진 보기, 촬영 모드 전환, 타이머 설정이 가능하다. 사용자는 시계 화면을 손가락으로 늘리거나 줄이는 핀치 동작이나, 시계의 베젤을 돌려 갤럭시 스마트폰의 카메라 줌을 원격으로 제어할 수 있다. 스마트폰을 먼 거리에 세워두고 단체 사진이나 단독 셀카를 찍을 때 카메라가 있는 곳까지 돌아갈 필요 없이 손목에서 바로 손쉽게 화면 배율 조정이 가능하다. 해당 기능은 원 UI 5.1 소프트웨어 지원 스마트폰과 연동해 이용할 수 있다. 적용 모델과 세부 시점은 추후 안내된다. 삼성전자 관계자는 ""삼성전자는 갤럭시 제품간 연동을 통해 보다 향상된 카메라 경험을 제공할 것""이라며 ""다음달 1일 진행되는 갤럭시 언팩에서 새로운 갤럭시 스마트폰과 관련된 더 많은 내용들이 소개될 것""이라고 밝혔다. 전화평 기자"
10,워치로 카메라 줌인하고 <b>버즈</b>로 동영상 녹음… <b>삼성</b> SW <b>업데이트</b>,http://moneys.mt.co.kr/news/mwView.php?no=2023011312052755639,https://n.news.naver.com/mnews/article/417/0000886647?sid=105,"<b>삼성전자</b> 대대적인 소프트웨어(SW) <b>업데이트</b>를 통해 스마트폰 카메라 사용성을 대폭 높였다. <b>삼성전자</b>는 무선 이어폰 갤럭시<b>버즈2 프로</b>, 폴더블폰(접이식 휴대폰) 갤럭시Z플립4·폴드4 SW <b>업데이트</b>를 진행한다고 13일... ","Fri, 13 Jan 2023 13:29:00 +0900","삼성전자 대대적인 소프트웨어(SW) 업데이트를 통해 스마트폰 카메라 사용성을 대폭 높였다.삼성전자는 무선 이어폰 갤럭시버즈2 프로, 폴더블폰(접이식 휴대폰) 갤럭시Z플립4·폴드4 SW 업데이트를 진행한다고 13일 밝혔다.갤럭시버즈2 프로를 낀 상태에서 갤럭시Z플립4폴드4로 동영상을 찍는 경우 촬영자는 연결된 갤럭시버즈2 프로를 통해 자신이 듣고 있는 생생한 소리를 담아낼 수 있다.과거엔 사운드 녹음은 스마트폰 마이크로만 할 수 있었다. 하지만 이번 업데이트로 본인 주위의 360도 풍부한 소리를 무선 이어폰을 통해 동영상에 입힐 수 있다.차세대 블루투스 오디오 기술 표준 LE(저전력) 오디오를 적용해 전력을 적게 소모하면서 음질 수준을 크게 개선했다. LE 오디오는 저전력·고품질이 장점인 만큼 보청기 시장에서도 각광을 받고 있다.삼성전자 관계자는 ""북적이는 행사장이나 물소리가 가득한 숲 한가운데서 동영상을 촬영할 때 연결된 갤럭시버즈2 프로로 자신이 듣는 그대로의 몰입형 사운드를 녹음할 수 있다""고 말했다.삼성전자는 갤럭시워치4·5의 SW도 업데이트할 방침이다. 스마트폰 카메라를 원격으로 줌인·아웃할 수 있는 기능을 탑재한다.해당 기능은 2월 중 기존 갤럭시워치 카메라 컨트롤러 애플리케이션(앱)에 추가된다. 사용자는 시계 화면을 손가락으로 늘리거나 줄이는 핀치 동작이나 시계의 베젤(테두리)을 돌려 갤럭시 스마트폰의 카메라 줌을 원격으로 제어할 수 있다.이에 따라 스마트폰을 먼 거리에 세워두고 단체 사진이나 단독 셀카를 찍을 때 카메라가 있는 곳까지 돌아가지 않고도 손목에서 손쉽게 화면 배율을 조정할 수 있다.이 기능은 원UI 5.1 소프트웨어 지원 스마트폰과 연동해 이용할 있다. 적용 모델과 세부 시점은 추후 안내할 예정이다.삼성전자 관계자는 ""삼성전자는 갤럭시 제품 간 연동을 통해 보다 향상된 카메라 경험을 제공할 것""이라며 ""다음달 2일 진행되는 갤럭시언팩(제품 공개)에서 새로운 갤럭시 스마트폰과 관련된 더 많은 내용들이 소개될 것""이라고 말했다."
11,"&quot;<b>버즈</b>로 360도 녹음, 워치로 줌 인&quot;…<b>삼성</b>, 폰카 편의성 높인다",http://www.newsis.com/view/?id=NISX20230113_0002157588&cID=13005&pID=13100,https://n.news.naver.com/mnews/article/003/0011640958?sid=105,<b>삼성전자</b>는 갤럭시 <b>버즈2 프로</b>와 갤럭시 Z 플립4∙폴드4의 소프트웨어 <b>업데이트</b>를 통해 &apos;360 오디오 레코딩&apos; 기능을 지원한다. 해당 기능을 통해 <b>버즈2 프로</b>를 착용하고 연결된 Z 플립4∙폴드4로 북적거리는 행사장 혹은... ,"Fri, 13 Jan 2023 08:50:00 +0900","기사내용 요약 플립·폴드4, 갤버즈2 프로, 갤워치4·5 SW 업데이트 진행 버즈2 프로에 '360 오디오 레코딩' 지원 ... 전방향 사운드 포착 갤워치로는 카메라 줌 인·아웃 ... ""베젤 돌려 카메라 줌 제어"" [서울=뉴시스]= 삼성전자가 갤럭시 버즈2 프로와 갤럭시 워치를 통해 스마트폰 카메라의 사용성을 한단계 더 진화시킨다.삼성전자는 스마트폰 동영상 촬영 시 360도 사운드 녹음이 가능하도록 갤럭시 버즈2 프로와 갤럭시 Z 플립4∙폴드4의 소프트웨어 업데이트를 13일부터 시행한다고 밝혔다. 갤럭시 워치5와 워치4 시리즈의 소프트웨어 업데이트를 통해 스마트폰 카메라를 원격으로 줌 인∙줌 아웃할 수 있는 기능도 추가된다.삼성전자는 갤럭시 버즈2 프로와 갤럭시 Z 플립4∙폴드4의 소프트웨어 업데이트를 통해 '360 오디오 레코딩' 기능을 지원한다.해당 기능을 통해 버즈2 프로를 착용하고 연결된 Z 플립4∙폴드4로 북적거리는 행사장 혹은 자연의 소리가 가득한 숲 한가운데서 동영상을 촬영할 경우 촬영자는 연결된 버즈2 프로를 통해 본인이 듣는 그대로의 생생한 몰입형 사운드를 녹음할 수 있게 된다.이는 갤럭시 버즈2 프로의 좌우에 위치한 마이크를 모두 사용해 360도 사운드를 포착하기 때문이다. 전문 장비 없이도 누구나 언제 어디서든 고품질의 실감나는 오디오를 동영상에 담을 수 있다는 게 삼성전자의 설명이다.특히 360 오디오 레코딩은 차세대 블루투스 오디오 기술 표준인 'LE 오디오(Low Energy Audio)'가 적용됐다. LE 오디오 기술은 보다 풍부하고 섬세한 사운드, 매끄러운 연결성, 향상된 배터리 수명을 제공한다.스마트폰 카메라 사용성 향상을 위해 갤럭시 워치5와 워치4 시리즈에 카메라 줌 인 줌 아웃 기능도 추가된다. 해당 기능은 오는 2월 중 기존의 워치 카메라 컨트롤러 앱에 추가된다. 현재는 사진 촬영, 촬영한 사진 보기, 촬영 모드 전환, 타이머 설정이 가능하다.사용자는 시계 화면을 손가락으로 늘리거나 줄이는 핀치 동작이나, 시계의 베젤을 돌려 갤럭시 스마트폰의 카메라 줌을 원격으로 제어할 수 있게 된다.이를 통해 스마트폰을 먼 거리에 세워두고 단체 사진이나 단독 셀카를 찍을 때 카메라가 있는 곳까지 돌아갈 필요 없이 손목에서 바로 손쉽게 화면 배율 조정이 가능해진다.해당 기능은 원 UI 5.1 소프트웨어 지원 스마트폰과 연동해 이용 가능하며, 적용 모델과 세부 시점은 추후 안내될 예정이다.삼성전자 관계자는 ""삼성전자는 갤럭시 제품간 연동을 통해 보다 향상된 카메라 경험을 제공할 것""이라며 ""다음달 1일 진행되는 갤럭시 언팩에서 새로운 갤럭시 스마트폰과 관련된 더 많은 내용들이 소개될 것""이라고 말했다."
12,"갤럭시 <b>버즈2 프로</b>·워치 등 <b>업데이트</b>, <b>삼성전자</b> &apos;스마트폰 카메라 사용성 차...",https://idsn.co.kr/news/view/1065583122569869,https://idsn.co.kr/news/view/1065583122569869,"▲ <b>삼성전자</b>는 갤럭시 <b>버즈2 프로</b>와 갤럭시 Z 플립4·폴드4의 소프트웨어 <b>업데이트</b>를 통해 360 오디오 레코딩 기능을 지원한다. 이를 통해, <b>버즈2 프로</b>를 착용하고 연결된 Z 플립4·폴드4로 북적거리는 행사장이나... ","Sun, 15 Jan 2023 13:38:00 +0900","▲ 삼성전자는 갤럭시 버즈2 프로와 갤럭시 Z 플립4·폴드4의 소프트웨어 업데이트를 통해 360 오디오 레코딩 기능을 지원한다. 이를 통해, 버즈2 프로를 착용하고 연결된 Z 플립4·폴드4로 북적거리는 행사장이나 새소리와 물소리가 가득한 숲 한가운데서 동영상을 촬영할 경우, 촬영자는 연결된 버즈2 프로를 통해 본인이 듣는 그대로의 생생한 몰입형 사운드를 녹음할 수 있게 된다(사진=삼성전자) [매일안전신문=손성창 기자] 삼성전자는 스마트폰 동영상 촬영 시 360도 사운드 녹음이 가능하도록 갤럭시 버즈2 프로와 갤럭시 Z플립4·폴드4의 소프트웨어 업데이트를 지난 13일부터 시행했다. 갤럭시 버즈2 프로와 갤럭시 워치를 통해 스마트폰 카메라의 사용성을 한단계 더 진화시키는 것이다. 갤럭시 버즈2 프로와 갤럭시 Z플립4·폴드4의 소프트웨어 업데이트를 통해 360 오디오 레코딩 기능을 지원한다. 버즈2 프로를 착용하고 연결된 Z플립4·폴드4로 북적거리는 행사장이나 새소리와 물소리가 가득한 숲 한가운데서 동영상을 촬영할 경우, 촬영자는 연결된 버즈2 프로를 통해 본인이 듣는 그대로의 생생한 몰입형 사운드를 녹음할 수 있게 된다. 이는 갤럭시 버즈2 프로의 좌우에 위치한 마이크를 모두 사용해 360도 사운드를 포착하기 때문이다. 전문 장비 없이도 언제 어디서든, 누구나 고품질의 실감나는 오디오를 동영상에 담을 수 있게 된다. 특히 360 오디오 레코딩은 차세대 블루투스 오디오 기술 표준인 LE오디오(Low Energy Audio)를 적용했다. LE오디오 기술은 풍부하고 섬세한 사운드, 매끄러운 연결성, 향상된 배터리 수명을 제공한다. 삼성전자는 갤럭시 워치5와 워치4 시리즈의 소프트웨어 업데이트를 통해 스마트폰 카메라를 원격으로 줌 인(Zooming In)·줌 아웃(Zooming Out)할 수 있는 기능을 추가한다. 스마트폰 카메라 사용성 향상하는 ㄷ것이다. 해당 기능은 2월 중 기존의 워치 카메라 컨트롤러 앱에 추가된다. 현재는 사진 촬영, 촬영한 사진 보기, 촬영 모드 전환, 타이머 설정이 가능하다. 사용자는 시계 화면을 손가락으로 늘리거나 줄이는 핀치 동작이나, 시계의 베젤을 돌려 갤럭시 스마트폰의 카메라 줌을 원격으로 제어할 수 있게 된다. 이를 통해 스마트폰을 먼 거리에 세워두고 단체 사진이나 단독 셀카를 찍을 때 카메라가 있는 곳까지 돌아갈 필요없이 손목에서 바로 손쉽게 화면 배율 조정이 가능해진다. 해당 기능은 원 UI 5.1 소프트웨어 지원 스마트폰과 연동해 이용 가능하다. 적용 모델과 세부 시점은 추후 안내된다. 삼성전자 관계자는 ""삼성전자는 갤럭시 제품간 연동을 통해 보다 향상된 카메라 경험을 제공할 것이라""며, ""다음달 1일 진행되는 갤럭시 언팩에서 새로운 갤럭시 스마트폰과 관련된 더 많은 내용들이 소개 될 것이라""고 강조했다. [저작권자 매일안전신문. 무단전재-재배포 금지]"
13,"<b>삼성전자</b>, <b>버즈2 프로</b>·워치로 스마트폰 카메라 사용성 한 차원 상향",http://www.joongboo.com/news/articleView.html?idxno=363574552,http://www.joongboo.com/news/articleView.html?idxno=363574552,<b>삼성전자</b>는 갤럭시 <b>버즈2 프로</b>와 갤럭시 Z 플립4?폴드4의 소프트웨어 <b>업데이트</b>를 통해 360 오디오 레코딩 기능을 지원한다. 사진=<b>삼성전자</b> <b>삼성전자</b>가 갤럭시 <b>버즈2 프로</b>와 갤럭시 워치를 통해 스마트폰 카메라의... ,"Sun, 15 Jan 2023 15:18:00 +0900","삼성전자는 갤럭시 버즈2 프로와 갤럭시 Z 플립4폴드4의 소프트웨어 업데이트를 통해 360 오디오 레코딩 기능을 지원한다. 사진=삼성전자 삼성전자가 갤럭시 버즈2 프로와 갤럭시 워치를 통해 스마트폰 카메라의 사용성을 한단계 더 진화시킨다고 15일 밝혔다. 삼성전자는 스마트폰 동영상 촬영 시 360도 사운드 녹음이 가능하도록 갤럭시 버즈2 프로와 갤럭시 Z 플립4폴드4의 소프트웨어 업데이트를 지난 13일부터 시행했다. 또한 갤럭시 워치5와 워치4 시리즈의 소프트웨어 업데이트를 통해 스마트폰 카메라를 원격으로 줌 인(Zooming In)·줌 아웃(Zooming Out) 할 수 있는 기능을 추가한다. 사용자가 듣는 대로 세상의 소리를 담아내는 '360 오디오 레코딩'은 버즈2 프로를 착용하고 연결된 Z 플립4폴드4로 북적거리는 행사장이나 새소리와 물소리가 가득한 숲 한가운데서 동영상을 촬영할 경우, 촬영자는 연결된 버즈2 프로를 통해 본인이 듣는 그대로의 생생한 몰입형 사운드를 녹음할 수 있게 한다. 이는 갤럭시 버즈2 프로의 좌우에 위치한 마이크를 모두 사용해 360도 사운드를 포착하기 때문이다. 전문 장비 없이도 언제 어디서든, 누구나 고품질의 실감나는 오디오를 동영상에 담을 수 있게 된다. 손목에서 바로 줌 인과 줌 아웃이 가능한 카메라 컨트롤러는 오는 2월 중 기존의 워치 카메라 컨트롤러 앱에 추가된다. 현재는 사진 촬영, 촬영한 사진 보기, 촬영 모드 전환, 타이머 설정이 가능하다. 사용자는 시계 화면을 손가락으로 늘리거나 줄이는 핀치 동작이나, 시계의 베젤을 돌려 갤럭시 스마트폰의 카메라 줌을 원격으로 제어할 수 있게 된다. 이를 통해 스마트폰을 먼 거리에 세워두고 단체 사진이나 단독 셀카를 찍을 때 카메라가 있는 곳까지 돌아갈 필요없이 손목에서 바로 손쉽게 화면 배율 조정이 가능해진다. 삼성전자 관계자는 ""삼성전자는 갤럭시 제품간 연동을 통해 보다 향상된 카메라 경험을 제공할 것""이라며 ""다음달 1일 진행되는 갤럭시 언팩에서 새로운 갤럭시 스마트폰과 관련된 더 많은 내용들이 소개 될 것""이라고 말했다. 김현우기자"
14,"<b>삼성전자</b>, <b>버즈2프로</b> SW <b>업데이트</b>...&quot;360도 소리 녹음 지원&quot;",http://www.finomy.com/news/articleView.html?idxno=123731,http://www.finomy.com/news/articleView.html?idxno=123731,<b>삼성전자</b>는 갤럭시 <b>버즈2 프로</b>와 갤럭시 Z 플립4·폴드4의 소프트웨어 <b>업데이트</b>를 통해 360 오디오 레코딩 기능을 지원한다. <b>버즈2 프로</b>를 착용하고 연결된 Z 플립4·폴드4로 북적거리는 행사장이나 새소리와 물소리가... ,"Fri, 13 Jan 2023 09:46:00 +0900","▲ [신문 하지현 기자] 삼성전자는 스마트폰 동영상 촬영 시 360도 사운드 녹음이 가능하도록 갤럭시 버즈2 프로와 갤럭시 Z 플립4·폴드4의 소프트웨어 업데이트를 시행한다고 13일 밝혔다. 갤럭시 워치5와 워치4 시리즈의 소프트웨어 업데이트를 통해 스마트폰 카메라를 원격으로 줌 인(Zooming In), 줌 아웃(Zooming Out) 할 수 있는 기능을 추가한다. 삼성전자는 갤럭시 버즈2 프로와 갤럭시 Z 플립4·폴드4의 소프트웨어 업데이트를 통해 360 오디오 레코딩 기능을 지원한다. 버즈2 프로를 착용하고 연결된 Z 플립4·폴드4로 북적거리는 행사장이나 새소리와 물소리가 가득한 숲 한가운데서 동영상을 촬영할 경우, 촬영자는 연결된 버즈2 프로를 통해 본인이 듣는 그대로의 생생한 몰입형 사운드를 녹음할 수 있게 된다. 이는 갤럭시 버즈2 프로의 좌우에 위치한 마이크를 모두 사용해 360도 사운드를 포착하기 때문이다. 전문 장비 없이도 언제 어디서든, 누구나 고품질의 실감나는 오디오를 동영상에 담을 수 있게 된다. 360 오디오 레코딩은 차세대 블루투스 오디오 기술 표준인 LE 오디오(Low Energy Audio)를 적용했다. LE 오디오 기술은 보다 풍부하고 섬세한 사운드, 매끄러운 연결성, 향상된 배터리 수명을 제공한다. 삼성전자는 스마트폰 카메라 사용성 향상을 위해 갤럭시 워치5와 워치4 시리즈에 카메라 줌 인 줌 아웃 기능을 추가한다. 해당 기능은 2월 중 기존의 워치 카메라 컨트롤러 앱에 추가된다. 현재는 사진 촬영, 촬영한 사진 보기, 촬영 모드 전환, 타이머 설정이 가능하다. 사용자는 시계 화면을 손가락으로 늘리거나 줄이는 핀치 동작이나, 시계의 베젤을 돌려 갤럭시 스마트폰의 카메라 줌을 원격으로 제어할 수 있게 된다. 스마트폰을 먼 거리에 세워두고 단체 사진이나 단독 셀카를 찍을 때 카메라가 있는 곳까지 돌아갈 필요없이 손목에서 바로 손쉽게 화면 배율 조정이 가능해진다. 해당 기능은 원 UI 5.1 소프트웨어 지원 스마트폰과 연동해 이용 가능하다. 적용 모델과 세부 시점은 추후 안내된다. 삼성전자 관계자는 ""삼성전자는 갤럭시 제품간 연동을 통해 보다 향상된 카메라 경험을 제공할 것""이라며 ""다음달 1일 진행되는 갤럭시 언팩에서 새로운 갤럭시 스마트폰과 관련된 더 많은 내용들이 소개 될 것""이라고 말했다."
15,"<b>삼성전자</b>, 갤럭시<b>버즈2프로</b> SW <b>업데이트</b>…&quot;360도 소리 녹음 지원&quot;",http://www.digitaltoday.co.kr/news/articleView.html?idxno=468385,http://www.digitaltoday.co.kr/news/articleView.html?idxno=468385,<b>삼성전자</b>는 스마트폰으로 동영상 촬영 시 전방위서 들려오는 소리를 녹음할 수 있도록 갤럭시 <b>버즈2 프로</b> 및 갤럭시Z플립4·갤럭시Z폴드4의 소프트웨어 <b>업데이트</b>를 13일부터 시행한다고 밝혔다. 소프트웨어를... ,"Fri, 13 Jan 2023 10:20:00 +0900","[디지털투데이 백연식 기자] 삼성전자는 스마트폰으로 동영상 촬영 시 전방위서 들려오는 소리를 녹음할 수 있도록 갤럭시 버즈2 프로 및 갤럭시Z플립4·갤럭시Z폴드4의 소프트웨어 업데이트를 13일부터 시행한다고 밝혔다. 소프트웨어를 업데이트하면 갤럭시버즈2 프로 좌우에 있는 마이크가 모두 사용돼 360도에서 들려오는 소리를 플립4·폴드4로 녹음할 수 있다. 녹음에는 차세대 블루투스 오디오 기술 표준인 LE 오디오가 적용됐다. 이와 함께 삼성전자는 다음 달 갤럭시 워치5와 워치4 시리즈에 카메라 줌 인, 줌 아웃 기능을 추가한다고 전했다. 삼성전자 관계자는 ""갤럭시 제품 간 연동을 통해 더욱 향상된 카메라 경험을 제공할 것""이라며 ""다음 달 진행되는 갤럭시 언팩에서 새로운 갤럭시 스마트폰과 관련된 더 많은 내용을 소개할 것""이라고 말했다."
16,"&quot;360도 사운드 녹음&quot; <b>삼성전자</b>, 갤럭시 <b>버즈2 프로</b>·워치 SW <b>업데이트</b>",http://www.4th.kr/news/articleView.html?idxno=2032130,http://www.4th.kr/news/articleView.html?idxno=2032130,포쓰저널 이현민 기자 사진=<b>삼성전자</b> <b>삼성전자</b>는 스마트폰 동영상 촬영 시 360도 사운드 녹음이 가능하도록 갤럭시 <b>버즈2 프로</b>와 갤럭시 Z 플립4·폴드4의 소프트웨어 <b>업데이트</b>를 13일부터 시행한다고 밝혔다. 이를... ,"Fri, 13 Jan 2023 10:00:00 +0900","사진=삼성전자 [포쓰저널=이현민 기자] 삼성전자는 스마트폰 동영상 촬영 시 360도 사운드 녹음이 가능하도록 갤럭시 버즈2 프로와 갤럭시 Z 플립4·폴드4의 소프트웨어 업데이트를 13일부터 시행한다고 밝혔다. 이를 통해 버즈2 프로가 착용되고 연결된 Z 플립4·폴드4로 북적거리는 행사장이나 새소리와 물소리가 가득한 숲 한가운데서 동영상을 촬영할 경우 촬영자는 연결된 버즈2 프로를 통해 듣는 그대로의 몰입형 사운드를 녹음할 수 있게 된다. 삼성전자에 따르면 이는 갤럭시 버즈2 프로의 좌우에 위치한 마이크를 통해 360도 사운드를 포착하기 할 수 있기에 가능하다. 특히 360 오디오 레코딩은 차세대 블루투스 오디오 기술 표준인 LE 오디오(Low Energy Audio)가 적용됐다. LE 오디오 기술은 보다 풍부하고 섬세한 사운드, 매끄러운 연결성, 향상된 배터리 수명을 제공한다. 아울러 삼성전자는 갤럭시 워치5와 워치4 시리즈의 소프트웨어 업데이트를 통해 스마트폰 카메라를 원격으로 줌 인(Zooming In)·줌 아웃(Zooming Out) 할 수 있는 기능을 추가한다. 해당 기능은 2월 중 기존의 워치 카메라 컨트롤러 앱에 추가된다. 현재는 사진 촬영, 촬영한 사진 보기, 촬영 모드 전환, 타이머 설정이 가능하다. 사용자는 시계 화면을 손가락으로 늘리거나 줄이고 시계의 베젤을 돌려 갤럭시 스마트폰의 카메라 줌을 원격으로 제어할 수 있게 된다. 이를 통해 스마트폰을 먼 거리에 세워두고 단체 사진이나 단독 셀카를 찍을 때 카메라가 있는 곳까지 돌아갈 필요 없이 손목에서 손쉽게 화면 배율을 조정할 수 있다. 해당 기능은 원 UI 5.1 소프트웨어 지원 스마트폰과 연동해 이용할 수 있다. 적용 모델과 세부 시점은 추후 안내된다. 삼성전자 관계자는 ""삼성전자는 갤럭시 제품 간 연동을 통해 보다 향상된 카메라 경험을 제공할 것""이라며 ""다음달 1일 진행되는 갤럭시 언팩에서 새로운 갤럭시 스마트폰과 관련된 더 많은 내용들이 소개 될 것""이라고 말했다."
